{
  "schema_version": "strategy-packet.v1",
  "identity": {
    "project_id": "prj.myownmint",
    "run_id": "run.20260312t201000z-s001",
    "event_id": "event.20260312t201400z-strategy-packet",
    "era_id": "era.2026q1-execution",
    "plan_id": "plan.myownmint-phase2"
  },
  "strategy": {
    "revision_id": "strat.20260312-r1",
    "summary": "Prioritize dispatch quality and deterministic continuation to unlock reliable autonomous throughput.",
    "link_map_ref": "strategy/current/ECOSYSTEM_LINK_MAP.json"
  },
  "recommendations": [
    {
      "recommendation_id": "rec.dispatch-quality-first",
      "priority": "high",
      "summary": "Implement watcher-driven cycle release and redispatch-quality controls before broader runtime features.",
      "rationale": "This directly reduces non-actionable cycles and improves output per token budget.",
      "expected_impact": "Lower idle loops and better per-cycle productivity under constrained hardware/rate limits.",
      "risk_level": "medium"
    },
    {
      "recommendation_id": "rec.runtime-canary-rollout-window",
      "priority": "medium",
      "summary": "Expand canary task coverage for runtime coordination path regressions.",
      "rationale": "Gate failures earlier by linking KPI drift to concrete lane-level recommendations.",
      "expected_impact": "Faster issue isolation and lower failure amplification across planner/runtime handoffs.",
      "risk_level": "medium"
    }
  ],
  "constraints": {
    "hard": [
      "Preserve existing OP behavior unless feature flags explicitly enable new cycle-release mode."
    ],
    "soft": [
      "Default to token-conservative mode in low budget environments."
    ]
  },
  "kpi_targets": [
    {
      "metric": "non_actionable_cycle_ratio",
      "direction": "decrease",
      "target": ">=20% reduction versus baseline"
    },
    {
      "metric": "redispatch_loop_ratio",
      "direction": "decrease",
      "target": ">=15% reduction versus baseline"
    }
  ],
  "assumptions": [
    {
      "assumption_id": "assumption.telemetry-path-stable",
      "statement": "Telemetry path naming and ownership remain stable for this planning wave."
    },
    {
      "assumption_id": "assumption.runtime-ownership-confirmed",
      "statement": "Runtime orchestration ownership remains with the same operating team for KPI target rollout."
    }
  ],
  "kpi_target_artifact": {
    "kpi_targets": [
      {
        "target_id": "kpi.non-actionable-cycle-ratio",
        "metric_name": "non_actionable_cycle_ratio",
        "expected_direction": "decrease",
        "baseline_reference": "reports/optimus-prime/planning/STATE.md#cycle-metrics-baseline-2026-03-14",
        "confidence_level": "high",
        "originating_recommendation_ids": ["rec.dispatch-quality-first"],
        "assumption_ids": [
          "assumption.runtime-ownership-confirmed",
          "assumption.telemetry-path-stable"
        ]
      },
      {
        "target_id": "kpi.redispatch-loop-ratio",
        "metric_name": "redispatch_loop_ratio",
        "expected_direction": "decrease",
        "baseline_reference": "reports/optimus-prime/planning/STATE.md#redispatch-metrics-baseline-2026-03-14",
        "confidence_level": "medium",
        "originating_recommendation_ids": [
          "rec.dispatch-quality-first",
          "rec.runtime-canary-rollout-window"
        ],
        "assumption_ids": ["assumption.telemetry-path-stable"]
      }
    ],
    "totals": {
      "kpi_targets": 2,
      "unique_recommendations_linked": 2,
      "unique_assumptions_linked": 2
    }
  },
  "source": {
    "repo": "Optimus-Prime-GSD-Fusion",
    "tool": "op-tools/strategy"
  }
}
